<?xml version="1.0"?>
<!DOCTYPE issues [
<!ELEMENT issues (issue*)>
<!ATTLIST issues burpVersion CDATA "">
<!ATTLIST issues exportTime CDATA "">
<!ELEMENT issue (serialNumber, type, name, host, path, location, severity, confidence, issueBackground?, remediationBackground?, references?, vulnerabilityClassifications?, issueDetail?, issueDetailItems?, remediationDetail?, requestresponse*, collaboratorEvent*, infiltratorEvent*, staticAnalysis*, dynamicAnalysis*, prototypePollution*)>
<!ELEMENT serialNumber (#PCDATA)>
<!ELEMENT type (#PCDATA)>
<!ELEMENT name (#PCDATA)>
<!ELEMENT host (#PCDATA)>
<!ATTLIST host ip CDATA "">
<!ELEMENT path (#PCDATA)>
<!ELEMENT location (#PCDATA)>
<!ELEMENT severity (#PCDATA)>
<!ELEMENT confidence (#PCDATA)>
<!ELEMENT issueBackground (#PCDATA)>
<!ELEMENT remediationBackground (#PCDATA)>
<!ELEMENT references (#PCDATA)>
<!ELEMENT vulnerabilityClassifications (#PCDATA)>
<!ELEMENT issueDetail (#PCDATA)>
<!ELEMENT issueDetailItems (issueDetailItem*)>
<!ELEMENT issueDetailItem (#PCDATA)>
<!ELEMENT remediationDetail (#PCDATA)>
<!ELEMENT requestresponse (request?, response?, responseRedirected?)>
<!ELEMENT request (#PCDATA)>
<!ATTLIST request method CDATA "">
<!ATTLIST request base64 (true|false) "false">
<!ELEMENT response (#PCDATA)>
<!ATTLIST response base64 (true|false) "false">
<!ELEMENT responseRedirected (#PCDATA)>
<!ELEMENT sender (#PCDATA)>
<!ELEMENT message (#PCDATA)>
<!ELEMENT conversation (#PCDATA)>
<!ELEMENT recipient (#PCDATA)>
<!ELEMENT recipients (recipient*)>
<!ELEMENT smtp (sender, recipients, message, conversation)>
<!ELEMENT collaboratorEvent (interactionType, originIp, time, lookupType?, lookupHost?, requestresponse?, smtp?)>
<!ELEMENT interactionType (#PCDATA)>
<!ELEMENT originIp (#PCDATA)>
<!ELEMENT time (#PCDATA)>
<!ELEMENT lookupType (#PCDATA)>
<!ELEMENT lookupHost (#PCDATA)>
<!ELEMENT infiltratorEvent (parameterName, platform, signature, stackTrace?, parameterValue?, collaboratorEvent)>
<!ELEMENT parameterName (#PCDATA)>
<!ELEMENT platform (#PCDATA)>
<!ELEMENT signature (#PCDATA)>
<!ELEMENT stackTrace (#PCDATA)>
<!ELEMENT parameterValue (#PCDATA)>
<!ELEMENT dynamicAnalysis (source, sink, sourceStackTrace, sinkStackTrace, eventListenerStackTrace, sourceValue, sinkValue, eventHandlerData, eventHandlerDataType, eventHandlerManipulatedData, poc, origin, isOriginChecked, sourceElementId, sourceElementName, eventFiredEventName, eventFiredElementId, eventFiredElementName, eventFiredOuterHtml)>
<!ELEMENT prototypePollution (poc, pollutionTechnique, pollutionType)>
<!ELEMENT staticAnalysis (source, sink, codeSnippets)>
<!ELEMENT source (#PCDATA)>
<!ELEMENT sink (#PCDATA)>
<!ELEMENT sourceStackTrace (#PCDATA)>
<!ELEMENT sinkStackTrace (#PCDATA)>
<!ELEMENT eventListenerStackTrace (#PCDATA)>
<!ELEMENT sourceValue (#PCDATA)>
<!ELEMENT sinkValue (#PCDATA)>
<!ELEMENT eventHandlerData (#PCDATA)>
<!ELEMENT eventHandlerDataType (#PCDATA)>
<!ELEMENT sourceElementId (#PCDATA)>
<!ELEMENT sourceElementName (#PCDATA)>
<!ELEMENT eventFiredEventName (#PCDATA)>
<!ELEMENT eventFiredElementId (#PCDATA)>
<!ELEMENT eventFiredElementName (#PCDATA)>
<!ELEMENT eventFiredOuterHtml (#PCDATA)>
<!ELEMENT eventHandlerManipulatedData (#PCDATA)>
<!ELEMENT poc (#PCDATA)>
<!ELEMENT origin (#PCDATA)>
<!ELEMENT isOriginChecked (#PCDATA)>
<!ELEMENT codeSnippets (codeSnippet*)>
<!ELEMENT codeSnippet (#PCDATA)>
<!ELEMENT pollutionTechnique (#PCDATA)>
<!ELEMENT pollutionType (#PCDATA)>
]>
<issues burpVersion="2023.8.1" exportTime="Mon Mar 18 08:52:34 GMT 2024">
  <issue>
    <serialNumber>7059847129728830464</serialNumber>
    <type>134217728</type>
    <name><![CDATA[Private IP addresses disclosed]]></name>
    <host ip="172.22.0.3">http://web</host>
    <path><![CDATA[/commandi.php]]></path>
    <location><![CDATA[/commandi.php]]></location>
    <severity>Information</severity>
    <confidence>Certain</confidence>
    <issueBackground><![CDATA[<p>RFC 1918 specifies ranges of IP addresses that are reserved for use in private networks and cannot be routed on the public Internet. Although various methods exist by which an attacker can determine the public IP addresses in use by an organization, the private addresses used internally cannot usually be determined in the same ways.</p>
<p>Discovering the private addresses used within an organization can help an attacker in carrying out network-layer attacks aiming to penetrate the organization's internal infrastructure. </p>]]></issueBackground>
    <remediationBackground><![CDATA[<p>There is not usually any good reason to disclose the internal IP addresses used within an organization's infrastructure. If these are being returned in service banners or debug messages, then the relevant services should be configured to mask the private addresses. If they are being used to track back-end servers for load balancing purposes, then the addresses should be rewritten with innocuous identifiers from which an attacker cannot infer any useful information about the infrastructure.</p>]]></remediationBackground>
    <issueDetail><![CDATA[The following RFC 1918 IP address was disclosed in the response:<ul><li>172.22.0.3</li></ul>]]></issueDetail>
    <issueDetailItems>
      <issueDetailItem><![CDATA[172.22.0.3]]></issueDetailItem>
    </issueDetailItems>
    <requestresponse>
      <request method="POST" base64="true"><![CDATA[UE9TVCAvY29tbWFuZGkucGhwIEhUVFAvMS4wDQpIb3N0OiB3ZWINCkNvb2tpZTogc2VjdXJpdHlfbGV2ZWw9MA0KQ29udGVudC1MZW5ndGg6IDIzDQpDb250ZW50LVR5cGU6IGFwcGxpY2F0aW9uL3gtd3d3LWZvcm0tdXJsZW5jb2RlZA0KDQp0YXJnZXQ9ZnV6eiZmb3JtPXN1Ym1pdA==]]></request>
      <response base64="true"><![CDATA[SFRUUC8xLjEgNDAwIEJhZCBSZXF1ZXN0DQpEYXRlOiBNb24sIDE4IE1hciAyMDI0IDA4OjQ5OjMyIEdNVA0KU2VydmVyOiBBcGFjaGUvMi40LjU3IChEZWJpYW4pDQpDb250ZW50LUxlbmd0aDogMzAyDQpDb25uZWN0aW9uOiBjbG9zZQ0KQ29udGVudC1UeXBlOiB0ZXh0L2h0bWw7IGNoYXJzZXQ9aXNvLTg4NTktMQ0KDQo8IURPQ1RZUEUgSFRNTCBQVUJMSUMgIi0vL0lFVEYvL0RURCBIVE1MIDIuMC8vRU4iPgo8aHRtbD48aGVhZD4KPHRpdGxlPjQwMCBCYWQgUmVxdWVzdDwvdGl0bGU+CjwvaGVhZD48Ym9keT4KPGgxPkJhZCBSZXF1ZXN0PC9oMT4KPHA+WW91ciBicm93c2VyIHNlbnQgYSByZXF1ZXN0IHRoYXQgdGhpcyBzZXJ2ZXIgY291bGQgbm90IHVuZGVyc3RhbmQuPGJyIC8+CjwvcD4KPGhyPgo8YWRkcmVzcz5BcGFjaGUvMi40LjU3IChEZWJpYW4pIFNlcnZlciBhdCAxNzIuMjIuMC4zIFBvcnQgODA8L2FkZHJlc3M+CjwvYm9keT48L2h0bWw+Cg==]]></response>
      <responseRedirected>false</responseRedirected>
    </requestresponse>
  </issue>
  <issue>
    <serialNumber>233230365087819776</serialNumber>
    <type>134217728</type>
    <name><![CDATA[Input returned in response (reflected)]]></name>
    <host ip="172.22.0.3">http://web</host>
    <path><![CDATA[/commandi.php]]></path>
    <location><![CDATA[/commandi.php]]></location>
    <severity>Information</severity>
    <confidence>Certain</confidence>
    <issueBackground><![CDATA[<p>Reflection of input arises when data is copied from a request and echoed into the application's immediate response.</p><p>Input being returned in application responses is not a vulnerability in its own right. However, it is a prerequisite for many client-side vulnerabilities, including cross-site scripting, open redirection, content spoofing, and response header injection. Additionally, some server-side vulnerabilities such as SQL injection are often easier to identify and exploit when input is returned in responses. In applications where input retrieval is rare and the environment is resistant to automated testing (for example, due to a web application firewall), it might be worth subjecting instances of it to focused manual testing. </p>]]></issueBackground>
    <issueDetail><![CDATA[The value of the <b>target</b> request parameter is copied into the application's response.]]></issueDetail>
    <requestresponse>
      <request method="POST" base64="true"><![CDATA[UE9TVCAvY29tbWFuZGkucGhwIEhUVFAvMS4wDQpIb3N0OiB3ZWINCkNvb2tpZTogc2VjdXJpdHlfbGV2ZWw9MA0KQ29udGVudC1MZW5ndGg6IDIzDQpDb250ZW50LVR5cGU6IGFwcGxpY2F0aW9uL3gtd3d3LWZvcm0tdXJsZW5jb2RlZA0KDQp0YXJnZXQ9ZnV6enUxMDFxNDNuODEmZm9ybT1zdWJtaXQ=]]></request>
      <response base64="true"><![CDATA[SFRUUC8xLjEgMjAwIE9LDQpEYXRlOiBNb24sIDE4IE1hciAyMDI0IDA4OjQ5OjM0IEdNVA0KU2VydmVyOiBBcGFjaGUvMi40LjU3IChEZWJpYW4pDQpYLVBvd2VyZWQtQnk6IFBIUC84LjIuMTANClNldC1Db29raWU6IFBIUFNFU1NJRD1oaXFlaHJscGkzczJoZjM5YWt0OXVpbGlxNzsgcGF0aD0vDQpFeHBpcmVzOiBUaHUsIDE5IE5vdiAxOTgxIDA4OjUyOjAwIEdNVA0KQ2FjaGUtQ29udHJvbDogbm8tc3RvcmUsIG5vLWNhY2hlLCBtdXN0LXJldmFsaWRhdGUNClByYWdtYTogbm8tY2FjaGUNClNldC1Db29raWU6IFBIUFNFU1NJRD1rZjNsb2gzMWEyaGptNmdsMnY4OWNvOTY5NjsgcGF0aD0vDQpWYXJ5OiBBY2NlcHQtRW5jb2RpbmcNCkNvbm5lY3Rpb246IGNsb3NlDQpDb250ZW50LVR5cGU6IHRleHQvaHRtbDsgY2hhcnNldD1VVEYtOA0KDQoKPCFET0NUWVBFIGh0bWw+CjxodG1sPgoKPGhlYWQ+Cgo8bWV0YSBodHRwLWVxdWl2PSJDb250ZW50LVR5cGUiIGNvbnRlbnQ9InRleHQvaHRtbDsgY2hhcnNldD1VVEYtOCI+Cgo8IS0tPGxpbmsgcmVsPSJzdHlsZXNoZWV0IiB0eXBlPSJ0ZXh0L2NzcyIgaHJlZj0iaHR0cHM6Ly9mb250cy5nb29nbGVhcGlzLmNvbS9jc3M/ZmFtaWx5PUFyY2hpdGVjdHMrRGF1Z2h0ZXIiPi0tPgo8bGluayByZWw9InN0eWxlc2hlZXQiIHR5cGU9InRleHQvY3NzIiBocmVmPSJzdHlsZXNoZWV0cy9zdHlsZXNoZWV0LmNzcyIgbWVkaWE9InNjcmVlbiIgLz4KPGxpbmsgcmVsPSJzaG9ydGN1dCBpY29uIiBocmVmPSJpbWFnZXMvZmF2aWNvbi5pY28iIHR5cGU9ImltYWdlL3gtaWNvbiIgLz4KCjwhLS08c2NyaXB0IHNyYz0iLy9odG1sNXNoaXYuZ29vZ2xlY29kZS5jb20vc3ZuL3RydW5rL2h0bWw1LmpzIj48L3NjcmlwdD4tLT4KPHNjcmlwdCBzcmM9ImpzL2h0bWw1LmpzIj48L3NjcmlwdD4KCjx0aXRsZT5iV0FQUCAtIE9TIENvbW1hbmQgSW5qZWN0aW9uPC90aXRsZT4KCjwvaGVhZD4KCjxib2R5PgoKPGhlYWRlcj4KCjxoMT5iV0FQUDwvaDE+Cgo8aDI+YW4gZXh0cmVtZWx5IGJ1Z2d5IHdlYiBhcHAgITwvaDI+Cgo8L2hlYWRlcj4KCjxkaXYgaWQ9Im1lbnUiPgoKICAgIDx0YWJsZT4KCiAgICAgICAgPHRyPgoKICAgICAgICAgICAgPHRkPjxhIGhyZWY9InBvcnRhbC5waHAiPkJ1Z3M8L2E+PC90ZD4KICAgICAgICAgICAgPHRkPjxhIGhyZWY9InBhc3N3b3JkX2NoYW5nZS5waHAiPkNoYW5nZSBQYXNzd29yZDwvYT48L3RkPgogICAgICAgICAgICA8dGQ+PGEgaHJlZj0idXNlcl9leHRyYS5waHAiPkNyZWF0ZSBVc2VyPC9hPjwvdGQ+CiAgICAgICAgICAgIDx0ZD48YSBocmVmPSJzZWN1cml0eV9sZXZlbF9zZXQucGhwIj5TZXQgU2VjdXJpdHkgTGV2ZWw8L2E+PC90ZD4KICAgICAgICAgICAgPHRkPjxhIGhyZWY9InJlc2V0LnBocCIgb25jbGljaz0icmV0dXJuIGNvbmZpcm0oJ0FsbCBzZXR0aW5ncyB3aWxsIGJlIGNsZWFyZWQuIEFyZSB5b3Ugc3VyZT8nKTsiPlJlc2V0PC9hPjwvdGQ+CiAgICAgICAgICAgIDx0ZD48YSBocmVmPSJjcmVkaXRzLnBocCI+Q3JlZGl0czwvYT48L3RkPgogICAgICAgICAgICA8dGQ+PGEgaHJlZj0iaHR0cDovL2l0c2VjZ2FtZXMuYmxvZ3Nwb3QuY29tIiB0YXJnZXQ9Il9ibGFuayI+QmxvZzwvYT48L3RkPgogICAgICAgICAgICA8dGQ+PGEgaHJlZj0ibG9nb3V0LnBocCIgb25jbGljaz0icmV0dXJuIGNvbmZpcm0oJ0FyZSB5b3Ugc3VyZSB5b3Ugd2FudCB0byBsZWF2ZT8nKTsiPkxvZ291dDwvYT48L3RkPgogICAgICAgICAgICA8dGQ+PGZvbnQgY29sb3I9InJlZCI+V2VsY29tZSBBZG1pbjwvZm9udD48L3RkPgoKICAgICAgICA8L3RyPgoKICAgIDwvdGFibGU+Cgo8L2Rpdj4KCjxkaXYgaWQ9Im1haW4iPgoKICAgIDxoMT5PUyBDb21tYW5kIEluamVjdGlvbjwvaDE+CgogICAgPGZvcm0gYWN0aW9uPSIvY29tbWFuZGkucGhwIiBtZXRob2Q9IlBPU1QiPgoKICAgICAgICA8cD4KCiAgICAgICAgPGxhYmVsIGZvcj0idGFyZ2V0Ij5ETlMgbG9va3VwOjwvbGFiZWw+CiAgICAgICAgPGlucHV0IHR5cGU9InRleHQiIGlkPSJ0YXJnZXQiIG5hbWU9InRhcmdldCIgdmFsdWU9Ind3dy5uc2EuZ292Ij4KCiAgICAgICAgPGJ1dHRvbiB0eXBlPSJzdWJtaXQiIG5hbWU9ImZvcm0iIHZhbHVlPSJzdWJtaXQiPkxvb2t1cDwvYnV0dG9uPgoKICAgICAgICA8L3A+CgogICAgPC9mb3JtPgogICAgPHAgYWxpZ249ImxlZnQiPlNlcnZlcjoJCTEyNy4wLjAuMTEKQWRkcmVzczoJMTI3LjAuMC4xMSM1MwoKKiogc2VydmVyIGNhbid0IGZpbmQgZnV6enUxMDFxNDNuODE6IE5YRE9NQUlOCgo8L3A+CjwvZGl2PgoKPGRpdiBpZD0ic2lkZSI+CgogICAgPGEgaHJlZj0iaHR0cDovL3R3aXR0ZXIuY29tL01NRV9JVCIgdGFyZ2V0PSJibGFua18iIGNsYXNzPSJidXR0b24iPjxpbWcgc3JjPSIuL2ltYWdlcy90d2l0dGVyLnBuZyI+PC9hPgogICAgPGEgaHJlZj0iaHR0cDovL2JlLmxpbmtlZGluLmNvbS9pbi9tYWxpa21lc2VsbGVtIiB0YXJnZXQ9ImJsYW5rXyIgY2xhc3M9ImJ1dHRvbiI+PGltZyBzcmM9Ii4vaW1hZ2VzL2xpbmtlZGluLnBuZyI+PC9hPgogICAgPGEgaHJlZj0iaHR0cDovL3d3dy5mYWNlYm9vay5jb20vcGFnZXMvTU1FLUlULUF1ZGl0cy1TZWN1cml0eS8xMDQxNTMwMTk2NjQ4NzciIHRhcmdldD0iYmxhbmtfIiBjbGFzcz0iYnV0dG9uIj48aW1nIHNyYz0iLi9pbWFnZXMvZmFjZWJvb2sucG5nIj48L2E+CiAgICA8YSBocmVmPSJodHRwOi8vaXRzZWNnYW1lcy5ibG9nc3BvdC5jb20iIHRhcmdldD0iYmxhbmtfIiBjbGFzcz0iYnV0dG9uIj48aW1nIHNyYz0iLi9pbWFnZXMvYmxvZ2dlci5wbmciPjwvYT4KCjwvZGl2PgoKPGRpdiBpZD0iZGlzY2xhaW1lciI+CgogICAgPHA+YldBUFAgaXMgbGljZW5zZWQgdW5kZXIgPGEgcmVsPSJsaWNlbnNlIiBocmVmPSJodHRwOi8vY3JlYXRpdmVjb21tb25zLm9yZy9saWNlbnNlcy9ieS1uYy1uZC80LjAvIiB0YXJnZXQ9Il9ibGFuayI+PGltZyBzdHlsZT0idmVydGljYWwtYWxpZ246bWlkZGxlIiBzcmM9Ii4vaW1hZ2VzL2NjLnBuZyI+PC9hPiAmY29weTsgMjAxNCBNTUUgQlZCQSAvIEZvbGxvdyA8YSBocmVmPSJodHRwOi8vdHdpdHRlci5jb20vTU1FX0lUIiB0YXJnZXQ9Il9ibGFuayI+QE1NRV9JVDwvYT4gb24gVHdpdHRlciBhbmQgYXNrIGZvciBvdXIgY2hlYXQgc2hlZXQsIGNvbnRhaW5pbmcgYWxsIHNvbHV0aW9ucyEgLyBOZWVkIGFuIGV4Y2x1c2l2ZSA8YSBocmVmPSJodHRwOi8vd3d3Lm1tZWJ2YmEuY29tIiB0YXJnZXQ9Il9ibGFuayI+dHJhaW5pbmc8L2E+PzwvcD4KCjwvZGl2PgoKPGRpdiBpZD0iYmVlIj4KCiAgICA8aW1nIHNyYz0iLi9pbWFnZXMvYmVlXzEucG5nIj4KCjwvZGl2PgoKPGRpdiBpZD0ic2VjdXJpdHlfbGV2ZWwiPgoKICAgIDxmb3JtIGFjdGlvbj0iL2NvbW1hbmRpLnBocCIgbWV0aG9kPSJQT1NUIj4KCiAgICAgICAgPGxhYmVsPlNldCB5b3VyIHNlY3VyaXR5IGxldmVsOjwvbGFiZWw+PGJyIC8+CgogICAgICAgIDxzZWxlY3QgbmFtZT0ic2VjdXJpdHlfbGV2ZWwiPgoKICAgICAgICAgICAgPG9wdGlvbiB2YWx1ZT0iMCI+bG93PC9vcHRpb24+CiAgICAgICAgICAgIDxvcHRpb24gdmFsdWU9IjEiPm1lZGl1bTwvb3B0aW9uPgogICAgICAgICAgICA8b3B0aW9uIHZhbHVlPSIyIj5oaWdoPC9vcHRpb24+CgogICAgICAgIDwvc2VsZWN0PgoKICAgICAgICA8YnV0dG9uIHR5cGU9InN1Ym1pdCIgbmFtZT0iZm9ybV9zZWN1cml0eV9sZXZlbCIgdmFsdWU9InN1Ym1pdCI+U2V0PC9idXR0b24+CiAgICAgICAgPGZvbnQgc2l6ZT0iNCI+Q3VycmVudDogPGI+bG93PC9iPjwvZm9udD4KCiAgICA8L2Zvcm0+Cgo8L2Rpdj4KCjxzdHlsZT4KZGl2I2J1ZyBhIHtmb250LXdlaWdodDogYm9sZDsgY3Vyc29yOiBwb2ludGVyO30KI2J1ZyB7Ym90dG9tOiAwOyB9CiNidWcgZm9ybSB7cG9zaXRpb246IGFic29sdXRlOyB0b3A6IDA7IGJvdHRvbTogMDsgfQojYnVnIHNlbGVjdC5zdHJldGNoIHtoZWlnaHQ6IDgwJTsgfQojYnVnIGRpdiB7ZGlzcGxheTogZmxleDsgaGVpZ2h0OiAxMDAlOyBhbGlnbi1pdGVtczogZmxleC1zdGFydDt9CiNidWcgYnV0dG9uIHtkaXNwbGF5OiBub25lO30KI2J1ZyBzbWFsbCB7Zm9udC1zaXplOiA3MCV9Cjwvc3R5bGU+CjxkaXYgaWQ9ImJ1ZyIgY2xhc3M9ImJ1Z3MiPgoKICA8Zm9ybSBhY3Rpb249Ii9jb21tYW5kaS5waHAiIG1ldGhvZD0iUE9TVCIgbmFtZT0iZ290X3RvX2J1ZyIgdGFyZ2V0PSJfYmxhbmsiPgoKICAgIDxsYWJlbD5DaG9vc2UgeW91ciBidWc6IDxzbWFsbD48aW5wdXQgdHlwZT0iY2hlY2tib3giIGlkPSJuZXdfdGFiIiBjaGVja2VkPSJjaGVja2VkIj7CoG9wZW4gaW4gbmV3IHRhYjwvc21hbGw+PC9sYWJlbD48YnIgLz4KICAgIDxkaXY+CiAgICAgIDxhIGlkPSJwcmV2X2J1ZyIgdGl0bGU9IkdvIHRvIHByZXYgYnVnIj7Cq8Krwqs8L2E+CiAgICAgIDxzZWxlY3QgaWQ9ImJ1Zy1zZWxlY3QiIG5hbWU9ImJ1ZyIgc2l6ZT0iMyI+CgogICAgICAgIAogICAgICAgICAgPG9wdGlvbiB0aXRsZT0ncG9ydGFsLnBocCcgdmFsdWU9JzAnID4tLS0tLS0tLS0tLS0tLS0tLS0tLS0tICBiV0FQUCB2Mi4yICAtLS0tLS0tLS0tLS0tLS0tLS0tLS0tLTwvb3B0aW9uPgogICAgICAgICAgPG9wdGlvbiB0aXRsZT0ncG9ydGFsLnBocCcgdmFsdWU9JzEnID4vIEExIC0gSW5qZWN0aW9uIC88L29wdGlvbj4KICAgICAgICAgIDxvcHRpb24gdGl0bGU9J2h0bWxpX2dldC5waHAnIHZhbHVlPScyJyA+SFRNTCBJbmplY3Rpb24gLSBSZWZsZWN0ZWQgKEdFVCk8L29wdGlvbj4KICAgICAgICAgIDxvcHRpb24gdGl0bGU9J2h0bWxpX3Bvc3QucGhwJyB2YWx1ZT0nMycgPkhUTUwgSW5qZWN0aW9uIC0gUmVmbGVjdGVkIChQT1NUKTwvb3B0aW9uPgogICAgICAgICAgPG9wdGlvbiB0aXRsZT0naHRtbGlfY3VycmVudF91cmwucGhwJyB2YWx1ZT0nNCcgPkhUTUwgSW5qZWN0aW9uIC0gUmVmbGVjdGVkIChDdXJyZW50IFVSTCk8L29wdGlvbj4KICAgICAgICAgIDxvcHRpb24gdGl0bGU9J2h0bWxpX3N0b3JlZC5waHAnIHZhbHVlPSc1JyA+SFRNTCBJbmplY3Rpb24gLSBTdG9yZWQgKEJsb2cpPC9vcHRpb24+CiAgICAgICAgICA8b3B0aW9uIHRpdGxlPScgaWZyYW1laS5waHAnIHZhbHVlPSc2JyA+aUZyYW1lIEluamVjdGlvbjwvb3B0aW9uPgogICAgICAgICAgPG9wdGlvbiB0aXRsZT0nbGRhcGkucGhwJyB2YWx1ZT0nNycgPkxEQVAgSW5qZWN0aW9uIChTZWFyY2gpPC9vcHRpb24+CiAgICAgICAgICA8b3B0aW9uIHRpdGxlPSdtYWlsaS5waHAnIHZhbHVlPSc4JyA+TWFpbCBIZWFkZXIgSW5qZWN0aW9uIChTTVRQKTwvb3B0aW9uPgogICAgICAgICAgPG9wdGlvbiB0aXRsZT0nY29tbWFuZGkucGhwJyB2YWx1ZT0nOScgIHNlbGVjdGVkPSJzZWxlY3RlZCI+T1MgQ29tbWFuZCBJbmplY3Rpb248L29wdGlvbj4KICAgICAgICAgIDxvcHRpb24gdGl0bGU9J2NvbW1hbmRpX2JsaW5kLnBocCcgdmFsdWU9JzEwJyA+T1MgQ29tbWFuZCBJbmplY3Rpb24gLSBCbGluZDwvb3B0aW9uPgogICAgICAgICAgPG9wdGlvbiB0aXRsZT0ncGhwaS5waHAnIHZhbHVlPScxMScgPlBIUCBDb2RlIEluamVjdGlvbjwvb3B0aW9uPgogICAgICAgICAgPG9wdGlvbiB0aXRsZT0nc3NpaS5waHAnIHZhbHVlPScxMicgPlNlcnZlci1TaWRlIEluY2x1ZGVzIChTU0kpIEluamVjdGlvbjwvb3B0aW9uPgogICAgICAgICAgPG9wdGlvbiB0aXRsZT0nc3FsaV8xLnBocCcgdmFsdWU9JzEzJyA+U1FMIEluamVjdGlvbiAoR0VUL1NlYXJjaCk8L29wdGlvbj4KICAgICAgICAgIDxvcHRpb24gdGl0bGU9J3NxbGlfMi5waHAnIHZhbHVlPScxNCcgPlNRTCBJbmplY3Rpb24gKEdFVC9TZWxlY3QpPC9vcHRpb24+CiAgICAgICAgICA8b3B0aW9uIHRpdGxlPSdzcWxpXzYucGhwJyB2YWx1ZT0nMTUnID5TUUwgSW5qZWN0aW9uIChQT1NUL1NlYXJjaCk8L29wdGlvbj4KICAgICAgICAgIDxvcHRpb24gdGl0bGU9J3NxbGlfMTMucGhwJyB2YWx1ZT0nMTYnID5TUUwgSW5qZWN0aW9uIChQT1NUL1NlbGVjdCk8L29wdGlvbj4KICAgICAgICAgIDxvcHRpb24gdGl0bGU9J3NxbGlfMTAtMS5waHAnIHZhbHVlPScxNycgPlNRTCBJbmplY3Rpb24gKEFKQVgvSlNPTi9qUXVlcnkpPC9vcHRpb24+CiAgICAgICAgICA8b3B0aW9uIHRpdGxlPSdzcWxpXzkucGhwJyB2YWx1ZT0nMTgnID5TUUwgSW5qZWN0aW9uIChDQVBUQ0hBKTwvb3B0aW9uPgogICAgICAgICAgPG9wdGlvbiB0aXRsZT0nc3FsaV8zLnBocCcgdmFsdWU9JzE5JyA+U1FMIEluamVjdGlvbiAoTG9naW4gRm9ybS9IZXJvKTwvb3B0aW9uPgogICAgICAgICAgPG9wdGlvbiB0aXRsZT0nc3FsaV8xNi5waHAnIHZhbHVlPScyMCcgPlNRTCBJbmplY3Rpb24gKExvZ2luIEZvcm0vVXNlcik8L29wdGlvbj4KICAgICAgICAgIDxvcHRpb24gdGl0bGU9J3NxbGlfMTEucGhwJyB2YWx1ZT0nMjEnID5TUUwgSW5qZWN0aW9uIChTUUxpdGUpPC9vcHRpb24+CiAgICAgICAgICA8b3B0aW9uIHRpdGxlPSdzcWxpX2RydXBhbC5waHAnIHZhbHVlPScyMicgPlNRTCBJbmplY3Rpb24gKERydXBhbCk8L29wdGlvbj4KICAgICAgICAgIDxvcHRpb24gdGl0bGU9J3NxbGlfNy5waHAnIHZhbHVlPScyMycgPlNRTCBJbmplY3Rpb24gLSBTdG9yZWQgKEJsb2cpPC9vcHRpb24+CiAgICAgICAgICA8b3B0aW9uIHRpdGxlPSdzcWxpXzEyLnBocCcgdmFsdWU9JzI0JyA+U1FMIEluamVjdGlvbiAtIFN0b3JlZCAoU1FMaXRlKTwvb3B0aW9uPgogICAgICAgICAgPG9wdGlvbiB0aXRsZT0nc3FsaV8xNy5waHAnIHZhbHVlPScyNScgPlNRTCBJbmplY3Rpb24gLSBTdG9yZWQgKFVzZXItQWdlbnQpPC9vcHRpb24+CiAgICAgICAgICA8b3B0aW9uIHRpdGxlPSdzcWxpXzgtMS5waHAnIHZhbHVlPScyNicgPlNRTCBJbmplY3Rpb24gLSBTdG9yZWQgKFhNTCk8L29wdGlvbj4KICAgICAgICAgIDxvcHRpb24gdGl0bGU9J3NxbGlfNC5waHAnIHZhbHVlPScyNycgPlNRTCBJbmplY3Rpb24gLSBCbGluZCAtIEJvb2xlYW4tQmFzZWQ8L29wdGlvbj4KICAgICAgICAgIDxvcHRpb24gdGl0bGU9J3NxbGlfMTUucGhwJyB2YWx1ZT0nMjgnID5TUUwgSW5qZWN0aW9uIC0gQmxpbmQgLSBUaW1lLUJhc2VkPC9vcHRpb24+CiAgICAgICAgICA8b3B0aW9uIHRpdGxlPSdzcWxpXzE0LnBocCcgdmFsdWU9JzI5JyA+U1FMIEluamVjdGlvbiAtIEJsaW5kIChTUUxpdGUpPC9vcHRpb24+CiAgICAgICAgICA8b3B0aW9uIHRpdGxlPSdzcWxpXzUucGhwJyB2YWx1ZT0nMzAnID5TUUwgSW5qZWN0aW9uIC0gQmxpbmQgKFdlYiBTZXJ2aWNlcy9TT0FQKTwvb3B0aW9uPgogICAgICAgICAgPG9wdGlvbiB0aXRsZT0neG1saV8xLnBocCcgdmFsdWU9JzMxJyA+WE1ML1hQYXRoIEluamVjdGlvbiAoTG9naW4gRm9ybSk8L29wdGlvbj4KICAgICAgICAgIDxvcHRpb24gdGl0bGU9J3htbGlfMi5waHAnIHZhbHVlPSczMicgPlhNTC9YUGF0aCBJbmplY3Rpb24gKFNlYXJjaCk8L29wdGlvbj4KICAgICAgICAgIDxvcHRpb24gdGl0bGU9J3BvcnRhbC5waHAnIHZhbHVlPSczMycgPi88L29wdGlvbj4KICAgICAgICAgIDxvcHRpb24gdGl0bGU9J3BvcnRhbC5waHAnIHZhbHVlPSczNCcgPi8gQTIgLSBCcm9rZW4gQXV0aC4gJiBTZXNzaW9uIE1nbXQuIC88L29wdGlvbj4KICAgICAgICAgIDxvcHRpb24gdGl0bGU9J2JhX2NhcHRjaGFfYnlwYXNzLnBocCcgdmFsdWU9JzM1JyA+QnJva2VuIEF1dGhlbnRpY2F0aW9uIC0gQ0FQVENIQSBCeXBhc3Npbmc8L29wdGlvbj4KICAgICAgICAgIDxvcHRpb24gdGl0bGU9J2JhX2ZvcmdvdHRlbi5waHAnIHZhbHVlPSczNicgPkJyb2tlbiBBdXRoZW50aWNhdGlvbiAtIEZvcmdvdHRlbiBGdW5jdGlvbjwvb3B0aW9uPgogICAgICAgICAgPG9wdGlvbiB0aXRsZT0nYmFfaW5zZWN1cmVfbG9naW4ucGhwJyB2YWx1ZT0nMzcnID5Ccm9rZW4gQXV0aGVudGljYXRpb24gLSBJbnNlY3VyZSBMb2dpbiBGb3Jtczwvb3B0aW9uPgogICAgICAgICAgPG9wdGlvbiB0aXRsZT0nYmFfbG9nb3V0LnBocCcgdmFsdWU9JzM4JyA+QnJva2VuIEF1dGhlbnRpY2F0aW9uIC0gTG9nb3V0IE1hbmFnZW1lbnQ8L29wdGlvbj4KICAgICAgICAgIDxvcHRpb24gdGl0bGU9J2JhX3B3ZF9hdHRhY2tzLnBocCcgdmFsdWU9JzM5JyA+QnJva2VuIEF1dGhlbnRpY2F0aW9uIC0gUGFzc3dvcmQgQXR0YWNrczwvb3B0aW9uPgogICAgICAgICAgPG9wdGlvbiB0aXRsZT0nYmFfd2Vha19wd2QucGhwJyB2YWx1ZT0nNDAnID5Ccm9rZW4gQXV0aGVudGljYXRpb24gLSBXZWFrIFBhc3N3b3Jkczwvb3B0aW9uPgogICAgICAgICAgPG9wdGlvbiB0aXRsZT0nc21nbXRfYWRtaW5fcG9ydGFsLnBocCcgdmFsdWU9JzQxJyA+U2Vzc2lvbiBNYW5hZ2VtZW50IC0gQWRtaW5pc3RyYXRpdmUgUG9ydGFsczwvb3B0aW9uPgogICAgICAgICAgPG9wdGlvbiB0aXRsZT0nc21nbXRfY29va2llc19odHRwb25seS5waHAnIHZhbHVlPSc0MicgPlNlc3Npb24gTWFuYWdlbWVudCAtIENvb2tpZXMgKEhUVFBPbmx5KTwvb3B0aW9uPgogICAgICAgICAgPG9wdGlvbiB0aXRsZT0nc21nbXRfY29va2llc19zZWN1cmUucGhwJyB2YWx1ZT0nNDMnID5TZXNzaW9uIE1hbmFnZW1lbnQgLSBDb29raWVzIChTZWN1cmUpPC9vcHRpb24+CiAgICAgICAgICA8b3B0aW9uIHRpdGxlPSdzbWdtdF9zZXNzaW9uaWRfdXJsLnBocCcgdmFsdWU9JzQ0JyA+U2Vzc2lvbiBNYW5hZ2VtZW50IC0gU2Vzc2lvbiBJRCBpbiBVUkw8L29wdGlvbj4KICAgICAgICAgIDxvcHRpb24gdGl0bGU9J3NtZ210X3N0cm9uZ19zZXNzaW9ucy5waHAnIHZhbHVlPSc0NScgPlNlc3Npb24gTWFuYWdlbWVudCAtIFN0cm9uZyBTZXNzaW9uczwvb3B0aW9uPgogICAgICAgICAgPG9wdGlvbiB0aXRsZT0ncG9ydGFsLnBocCcgdmFsdWU9JzQ2JyA+Lzwvb3B0aW9uPgogICAgICAgICAgPG9wdGlvbiB0aXRsZT0ncG9ydGFsLnBocCcgdmFsdWU9JzQ3JyA+LyBBMyAtIENyb3NzLVNpdGUgU2NyaXB0aW5nIChYU1MpIC88L29wdGlvbj4KICAgICAgICAgIDxvcHRpb24gdGl0bGU9J3hzc19nZXQucGhwJyB2YWx1ZT0nNDgnID5Dcm9zcy1TaXRlIFNjcmlwdGluZyAtIFJlZmxlY3RlZCAoR0VUKTwvb3B0aW9uPgogICAgICAgICAgPG9wdGlvbiB0aXRsZT0neHNzX3Bvc3QucGhwJyB2YWx1ZT0nNDknID5Dcm9zcy1TaXRlIFNjcmlwdGluZyAtIFJlZmxlY3RlZCAoUE9TVCk8L29wdGlvbj4KICAgICAgICAgIDxvcHRpb24gdGl0bGU9J3hzc19qc29uLnBocCcgdmFsdWU9JzUwJyA+Q3Jvc3MtU2l0ZSBTY3JpcHRpbmcgLSBSZWZsZWN0ZWQgKEpTT04pPC9vcHRpb24+CiAgICAgICAgICA8b3B0aW9uIHRpdGxlPSd4c3NfYWpheF8yLTEucGhwJyB2YWx1ZT0nNTEnID5Dcm9zcy1TaXRlIFNjcmlwdGluZyAtIFJlZmxlY3RlZCAoQUpBWC9KU09OKTwvb3B0aW9uPgogICAgICAgICAgPG9wdGlvbiB0aXRsZT0neHNzX2FqYXhfMS0xLnBocCcgdmFsdWU9JzUyJyA+Q3Jvc3MtU2l0ZSBTY3JpcHRpbmcgLSBSZWZsZWN0ZWQgKEFKQVgvWE1MKTwvb3B0aW9uPgogICAgICAgICAgPG9wdGlvbiB0aXRsZT0neHNzX2JhY2tfYnV0dG9uLnBocCcgdmFsdWU9JzUzJyA+Q3Jvc3MtU2l0ZSBTY3JpcHRpbmcgLSBSZWZsZWN0ZWQgKEJhY2sgQnV0dG9uKTwvb3B0aW9uPgogICAgICAgICAgPG9wdGlvbiB0aXRsZT0neHNzX2N1c3RvbV9oZWFkZXIucGhwJyB2YWx1ZT0nNTQnID5Dcm9zcy1TaXRlIFNjcmlwdGluZyAtIFJlZmxlY3RlZCAoQ3VzdG9tIEhlYWRlcik8L29wdGlvbj4KICAgICAgICAgIDxvcHRpb24gdGl0bGU9J3hzc19ldmFsLnBocD9kYXRlPURhdGUoKScgdmFsdWU9JzU1JyA+Q3Jvc3MtU2l0ZSBTY3JpcHRpbmcgLSBSZWZsZWN0ZWQgKEV2YWwpPC9vcHRpb24+CiAgICAgICAgICA8b3B0aW9uIHRpdGxlPSd4c3NfaHJlZi0xLnBocCcgdmFsdWU9JzU2JyA+Q3Jvc3MtU2l0ZSBTY3JpcHRpbmcgLSBSZWZsZWN0ZWQgKEhSRUYpPC9vcHRpb24+CiAgICAgICAgICA8b3B0aW9uIHRpdGxlPSd4c3NfbG9naW4ucGhwJyB2YWx1ZT0nNTcnID5Dcm9zcy1TaXRlIFNjcmlwdGluZyAtIFJlZmxlY3RlZCAoTG9naW4gRm9ybSk8L29wdGlvbj4KICAgICAgICAgIDxvcHRpb24gdGl0bGU9J3hzc19waHBteWFkbWluLnBocCcgdmFsdWU9JzU4JyA+Q3Jvc3MtU2l0ZSBTY3JpcHRpbmcgLSBSZWZsZWN0ZWQgKHBocE15QWRtaW4pPC9vcHRpb24+CiAgICAgICAgICA8b3B0aW9uIHRpdGxlPSd4c3NfcGhwX3NlbGYucGhwJyB2YWx1ZT0nNTknID5Dcm9zcy1TaXRlIFNjcmlwdGluZyAtIFJlZmxlY3RlZCAoUEhQX1NFTEYpPC9vcHRpb24+CiAgICAgICAgICA8b3B0aW9uIHRpdGxlPSd4c3NfcmVmZXJlci5waHAnIHZhbHVlPSc2MCcgPkNyb3NzLVNpdGUgU2NyaXB0aW5nIC0gUmVmbGVjdGVkIChSZWZlcmVyKTwvb3B0aW9uPgogICAgICAgICAgPG9wdGlvbiB0aXRsZT0neHNzX3VzZXJfYWdlbnQucGhwJyB2YWx1ZT0nNjEnID5Dcm9zcy1TaXRlIFNjcmlwdGluZyAtIFJlZmxlY3RlZCAoVXNlci1BZ2VudCk8L29wdGlvbj4KICAgICAgICAgIDxvcHRpb24gdGl0bGU9J3hzc19zdG9yZWRfMS5waHAnIHZhbHVlPSc2MicgPkNyb3NzLVNpdGUgU2NyaXB0aW5nIC0gU3RvcmVkIChCbG9nKTwvb3B0aW9uPgogICAgICAgICAgPG9wdGlvbiB0aXRsZT0neHNzX3N0b3JlZF8zLnBocCcgdmFsdWU9JzYzJyA+Q3Jvc3MtU2l0ZSBTY3JpcHRpbmcgLSBTdG9yZWQgKENoYW5nZSBTZWNyZXQpPC9vcHRpb24+CiAgICAgICAgICA8b3B0aW9uIHRpdGxlPSd4c3Nfc3RvcmVkXzIucGhwJyB2YWx1ZT0nNjQnID5Dcm9zcy1TaXRlIFNjcmlwdGluZyAtIFN0b3JlZCAoQ29va2llcyk8L29wdGlvbj4KICAgICAgICAgIDxvcHRpb24gdGl0bGU9J3hzc19zcWxpdGVtYW5hZ2VyLnBocCcgdmFsdWU9JzY1JyA+Q3Jvc3MtU2l0ZSBTY3JpcHRpbmcgLSBTdG9yZWQgKFNRTGl0ZU1hbmFnZXIpPC9vcHRpb24+CiAgICAgICAgICA8b3B0aW9uIHRpdGxlPSd4c3Nfc3RvcmVkXzQucGhwJyB2YWx1ZT0nNjYnID5Dcm9zcy1TaXRlIFNjcmlwdGluZyAtIFN0b3JlZCAoVXNlci1BZ2VudCk8L29wdGlvbj4KICAgICAgICAgIDxvcHRpb24gdGl0bGU9J3BvcnRhbC5waHAnIHZhbHVlPSc2NycgPi88L29wdGlvbj4KICAgICAgICAgIDxvcHRpb24gdGl0bGU9J3BvcnRhbC5waHAnIHZhbHVlPSc2OCcgPi8gQTQgLSBJbnNlY3VyZSBEaXJlY3QgT2JqZWN0IFJlZmVyZW5jZXMgLzwvb3B0aW9uPgogICAgICAgICAgPG9wdGlvbiB0aXRsZT0naW5zZWN1cmVfZGlyZWN0X29iamVjdF9yZWZfMS5waHAnIHZhbHVlPSc2OScgPkluc2VjdXJlIERPUiAoQ2hhbmdlIFNlY3JldCk8L29wdGlvbj4KICAgICAgICAgIDxvcHRpb24gdGl0bGU9J2luc2VjdXJlX2RpcmVjdF9vYmplY3RfcmVmXzMucGhwJyB2YWx1ZT0nNzAnID5JbnNlY3VyZSBET1IgKFJlc2V0IFNlY3JldCk8L29wdGlvbj4KICAgICAgICAgIDxvcHRpb24gdGl0bGU9J2luc2VjdXJlX2RpcmVjdF9vYmplY3RfcmVmXzIucGhwJyB2YWx1ZT0nNzEnID5JbnNlY3VyZSBET1IgKE9yZGVyIFRpY2tldHMpPC9vcHRpb24+CiAgICAgICAgICA8b3B0aW9uIHRpdGxlPSdwb3J0YWwucGhwJyB2YWx1ZT0nNzInID4vPC9vcHRpb24+CiAgICAgICAgICA8b3B0aW9uIHRpdGxlPSdwb3J0YWwucGhwJyB2YWx1ZT0nNzMnID4vIEE1IC0gU2VjdXJpdHkgTWlzY29uZmlndXJhdGlvbiAvPC9vcHRpb24+CiAgICAgICAgICA8b3B0aW9uIHRpdGxlPSdzbV9zYW1iYS5waHAnIHZhbHVlPSc3NCcgPkFyYml0cmFyeSBGaWxlIEFjY2VzcyAoU2FtYmEpPC9vcHRpb24+CiAgICAgICAgICA8b3B0aW9uIHRpdGxlPSdzbV9jcm9zc19kb21haW5fcG9saWN5LnBocCcgdmFsdWU9Jzc1JyA+Q3Jvc3MtRG9tYWluIFBvbGljeSBGaWxlIChGbGFzaCk8L29wdGlvbj4KICAgICAgICAgIDxvcHRpb24gdGl0bGU9J3NtX2NvcnMucGhwJyB2YWx1ZT0nNzYnID5Dcm9zcy1PcmlnaW4gUmVzb3VyY2UgU2hhcmluZyAoQUpBWCk8L29wdGlvbj4KICAgICAgICAgIDxvcHRpb24gdGl0bGU9J3NtX3hzdC5waHAnIHZhbHVlPSc3NycgPkNyb3NzLVNpdGUgVHJhY2luZyAoWFNUKTwvb3B0aW9uPgogICAgICAgICAgPG9wdGlvbiB0aXRsZT0nc21fZG9zXzMucGhwJyB2YWx1ZT0nNzgnID5EZW5pYWwtb2YtU2VydmljZSAoTGFyZ2UgQ2h1bmsgU2l6ZSk8L29wdGlvbj4KICAgICAgICAgIDxvcHRpb24gdGl0bGU9J3NtX2Rvc18xLnBocCcgdmFsdWU9Jzc5JyA+RGVuaWFsLW9mLVNlcnZpY2UgKFNsb3cgSFRUUCBEb1MpPC9vcHRpb24+CiAgICAgICAgICA8b3B0aW9uIHRpdGxlPSdzbV9kb3NfNC5waHAnIHZhbHVlPSc4MCcgPkRlbmlhbC1vZi1TZXJ2aWNlIChTU0wtRXhoYXVzdGlvbik8L29wdGlvbj4KICAgICAgICAgIDxvcHRpb24gdGl0bGU9J3NtX2Rvc18yLnBocCcgdmFsdWU9JzgxJyA+RGVuaWFsLW9mLVNlcnZpY2UgKFhNTCBCb21iKTwvb3B0aW9uPgogICAgICAgICAgPG9wdGlvbiB0aXRsZT0nc21fZnRwLnBocCcgdmFsdWU9JzgyJyA+SW5zZWN1cmUgRlRQIENvbmZpZ3VyYXRpb248L29wdGlvbj4KICAgICAgICAgIDxvcHRpb24gdGl0bGU9J3NtX3NubXAucGhwJyB2YWx1ZT0nODMnID5JbnNlY3VyZSBTTk1QIENvbmZpZ3VyYXRpb248L29wdGlvbj4KICAgICAgICAgIDxvcHRpb24gdGl0bGU9J3NtX3dlYmRhdi5waHAnIHZhbHVlPSc4NCcgPkluc2VjdXJlIFdlYkRBViBDb25maWd1cmF0aW9uPC9vcHRpb24+CiAgICAgICAgICA8b3B0aW9uIHRpdGxlPSdzbV9sb2NhbF9wcml2X2VzY18xLnBocCcgdmFsdWU9Jzg1JyA+TG9jYWwgUHJpdmlsZWdlIEVzY2FsYXRpb24gKHNlbmRwYWdlKTwvb3B0aW9uPgogICAgICAgICAgPG9wdGlvbiB0aXRsZT0nc21fbG9jYWxfcHJpdl9lc2NfMi5waHAnIHZhbHVlPSc4NicgPkxvY2FsIFByaXZpbGVnZSBFc2NhbGF0aW9uICh1ZGV2KTwvb3B0aW9uPgogICAgICAgICAgPG9wdGlvbiB0aXRsZT0nc21fbWl0bV8xLnBocCcgdmFsdWU9Jzg3JyA+TWFuLWluLXRoZS1NaWRkbGUgQXR0YWNrIChIVFRQKTwvb3B0aW9uPgogICAgICAgICAgPG9wdGlvbiB0aXRsZT0nc21fbWl0bV8yLnBocCcgdmFsdWU9Jzg4JyA+TWFuLWluLXRoZS1NaWRkbGUgQXR0YWNrIChTTVRQKTwvb3B0aW9uPgogICAgICAgICAgPG9wdGlvbiB0aXRsZT0nc21fb2J1X2ZpbGVzLnBocCcgdmFsdWU9Jzg5JyA+T2xkL0JhY2t1cCAmIFVucmVmZXJlbmNlZCBGaWxlczwvb3B0aW9uPgogICAgICAgICAgPG9wdGlvbiB0aXRsZT0nc21fcm9ib3RzLnBocCcgdmFsdWU9JzkwJyA+Um9ib3RzIEZpbGU8L29wdGlvbj4KICAgICAgICAgIDxvcHRpb24gdGl0bGU9J3BvcnRhbC5waHAnIHZhbHVlPSc5MScgPi88L29wdGlvbj4KICAgICAgICAgIDxvcHRpb24gdGl0bGU9J3BvcnRhbC5waHAnIHZhbHVlPSc5MicgPi8gQTYgLSBTZW5zaXRpdmUgRGF0YSBFeHBvc3VyZSAvPC9vcHRpb24+CiAgICAgICAgICA8b3B0aW9uIHRpdGxlPSdpbnNlY3VyZV9jcnlwdF9zdG9yYWdlXzMucGhwJyB2YWx1ZT0nOTMnID5CYXNlNjQgRW5jb2RpbmcgKFNlY3JldCk8L29wdGlvbj4KICAgICAgICAgIDxvcHRpb24gdGl0bGU9J2luc3VmZl90cmFuc3BfbGF5ZXJfcHJvdGVjdF8zLnBocCcgdmFsdWU9Jzk0JyA+QkVBU1QvQ1JJTUUvQlJFQUNIIEF0dGFja3M8L29wdGlvbj4KICAgICAgICAgIDxvcHRpb24gdGl0bGU9J2luc3VmZl90cmFuc3BfbGF5ZXJfcHJvdGVjdF8xLnBocCcgdmFsdWU9Jzk1JyA+Q2xlYXIgVGV4dCBIVFRQIChDcmVkZW50aWFscyk8L29wdGlvbj4KICAgICAgICAgIDxvcHRpb24gdGl0bGU9J2hlYXJ0YmxlZWQucGhwJyB2YWx1ZT0nOTYnID5IZWFydGJsZWVkIFZ1bG5lcmFiaWxpdHk8L29wdGlvbj4KICAgICAgICAgIDxvcHRpb24gdGl0bGU9J2hvc3RoZWFkZXJfMi5waHAnIHZhbHVlPSc5NycgPkhvc3QgSGVhZGVyIEF0dGFjayAoUmVzZXQgUG9pc29uaW5nKTwvb3B0aW9uPgogICAgICAgICAgPG9wdGlvbiB0aXRsZT0naW5zZWN1cmVfY3J5cHRfc3RvcmFnZV8xLnBocCcgdmFsdWU9Jzk4JyA+SFRNTDUgV2ViIFN0b3JhZ2UgKFNlY3JldCk8L29wdGlvbj4KICAgICAgICAgIDxvcHRpb24gdGl0bGU9J2luc3VmZl90cmFuc3BfbGF5ZXJfcHJvdGVjdF80LnBocCcgdmFsdWU9Jzk5JyA+UE9PRExFIFZ1bG5lcmFiaWxpdHk8L29wdGlvbj4KICAgICAgICAgIDxvcHRpb24gdGl0bGU9J2luc3VmZl90cmFuc3BfbGF5ZXJfcHJvdGVjdF8yLnBocCcgdmFsdWU9JzEwMCcgPlNTTCAyLjAgRGVwcmVjYXRlZCBQcm90b2NvbDwvb3B0aW9uPgogICAgICAgICAgPG9wdGlvbiB0aXRsZT0naW5zZWN1cmVfY3J5cHRfc3RvcmFnZV8yLnBocCcgdmFsdWU9JzEwMScgPlRleHQgRmlsZXMgKEFjY291bnRzKTwvb3B0aW9uPgogICAgICAgICAgPG9wdGlvbiB0aXRsZT0ncG9ydGFsLnBocCcgdmFsdWU9JzEwMicgPi88L29wdGlvbj4KICAgICAgICAgIDxvcHRpb24gdGl0bGU9J3BvcnRhbC5waHAnIHZhbHVlPScxMDMnID4vIEE3IC0gTWlzc2luZyBGdW5jdGlvbmFsIExldmVsIEFjY2VzcyBDb250cm9sIC88L29wdGlvbj4KICAgICAgICAgIDxvcHRpb24gdGl0bGU9J2RpcmVjdG9yeV90cmF2ZXJzYWxfMi5waHA/ZGlyZWN0b3J5PWRvY3VtZW50cycgdmFsdWU9JzEwNCcgPkRpcmVjdG9yeSBUcmF2ZXJzYWwgLSBEaXJlY3Rvcmllczwvb3B0aW9uPgogICAgICAgICAgPG9wdGlvbiB0aXRsZT0nZGlyZWN0b3J5X3RyYXZlcnNhbF8xLnBocD9wYWdlPW1lc3NhZ2UudHh0JyB2YWx1ZT0nMTA1JyA+RGlyZWN0b3J5IFRyYXZlcnNhbCAtIEZpbGVzPC9vcHRpb24+CiAgICAgICAgICA8b3B0aW9uIHRpdGxlPSdob3N0aGVhZGVyXzEucGhwJyB2YWx1ZT0nMTA2JyA+SG9zdCBIZWFkZXIgQXR0YWNrIChDYWNoZSBQb2lzb25pbmcpPC9vcHRpb24+CiAgICAgICAgICA8b3B0aW9uIHRpdGxlPSdob3N0aGVhZGVyXzIucGhwJyB2YWx1ZT0nMTA3JyA+SG9zdCBIZWFkZXIgQXR0YWNrIChSZXNldCBQb2lzb25pbmcpPC9vcHRpb24+CiAgICAgICAgICA8b3B0aW9uIHRpdGxlPSdsZmlfc3FsaXRlbWFuYWdlci5waHAnIHZhbHVlPScxMDgnID5Mb2NhbCBGaWxlIEluY2x1c2lvbiAoU1FMaXRlTWFuYWdlcik8L29wdGlvbj4KICAgICAgICAgIDxvcHRpb24gdGl0bGU9J3JsZmkucGhwJyB2YWx1ZT0nMTA5JyA+UmVtb3RlICYgTG9jYWwgRmlsZSBJbmNsdXNpb24gKFJGSS9MRkkpPC9vcHRpb24+CiAgICAgICAgICA8b3B0aW9uIHRpdGxlPSdyZXN0cmljdF9kZXZpY2VfYWNjZXNzLnBocCcgdmFsdWU9JzExMCcgPlJlc3RyaWN0IERldmljZSBBY2Nlc3M8L29wdGlvbj4KICAgICAgICAgIDxvcHRpb24gdGl0bGU9J3Jlc3RyaWN0X2ZvbGRlcl9hY2Nlc3MucGhwJyB2YWx1ZT0nMTExJyA+UmVzdHJpY3QgRm9sZGVyIEFjY2Vzczwvb3B0aW9uPgogICAgICAgICAgPG9wdGlvbiB0aXRsZT0nc3NyZi5waHAnIHZhbHVlPScxMTInID5TZXJ2ZXIgU2lkZSBSZXF1ZXN0IEZvcmdlcnkgKFNTUkYpPC9vcHRpb24+CiAgICAgICAgICA8b3B0aW9uIHRpdGxlPSd4eGUtMS5waHAnIHZhbHVlPScxMTMnID5YTUwgRXh0ZXJuYWwgRW50aXR5IEF0dGFja3MgKFhYRSk8L29wdGlvbj4KICAgICAgICAgIDxvcHRpb24gdGl0bGU9J3BvcnRhbC5waHAnIHZhbHVlPScxMTQnID4vPC9vcHRpb24+CiAgICAgICAgICA8b3B0aW9uIHRpdGxlPSdwb3J0YWwucGhwJyB2YWx1ZT0nMTE1JyA+LyBBOCAtIENyb3NzLVNpdGUgUmVxdWVzdCBGb3JnZXJ5IChDU1JGKSAvPC9vcHRpb24+CiAgICAgICAgICA8b3B0aW9uIHRpdGxlPSdjc3JmXzEucGhwJyB2YWx1ZT0nMTE2JyA+Q3Jvc3MtU2l0ZSBSZXF1ZXN0IEZvcmdlcnkgKENoYW5nZSBQYXNzd29yZCk8L29wdGlvbj4KICAgICAgICAgIDxvcHRpb24gdGl0bGU9J2NzcmZfMy5waHAnIHZhbHVlPScxMTcnID5Dcm9zcy1TaXRlIFJlcXVlc3QgRm9yZ2VyeSAoQ2hhbmdlIFNlY3JldCk8L29wdGlvbj4KICAgICAgICAgIDxvcHRpb24gdGl0bGU9J2NzcmZfMi5waHAnIHZhbHVlPScxMTgnID5Dcm9zcy1TaXRlIFJlcXVlc3QgRm9yZ2VyeSAoVHJhbnNmZXIgQW1vdW50KTwvb3B0aW9uPgogICAgICAgICAgPG9wdGlvbiB0aXRsZT0ncG9ydGFsLnBocCcgdmFsdWU9JzExOScgPi88L29wdGlvbj4KICAgICAgICAgIDxvcHRpb24gdGl0bGU9J3BvcnRhbC5waHAnIHZhbHVlPScxMjAnID4vIEE5IC0gVXNpbmcgS25vd24gVnVsbmVyYWJsZSBDb21wb25lbnRzIC88L29wdGlvbj4KICAgICAgICAgIDxvcHRpb24gdGl0bGU9J2JvZl8xLnBocCcgdmFsdWU9JzEyMScgPkJ1ZmZlciBPdmVyZmxvdyAoTG9jYWwpPC9vcHRpb24+CiAgICAgICAgICA8b3B0aW9uIHRpdGxlPSdib2ZfMi5waHAnIHZhbHVlPScxMjInID5CdWZmZXIgT3ZlcmZsb3cgKFJlbW90ZSk8L29wdGlvbj4KICAgICAgICAgIDxvcHRpb24gdGl0bGU9J3NxbGlfZHJ1cGFsLnBocCcgdmFsdWU9JzEyMycgPkRydXBhbCBTUUwgSW5qZW